{"action_kind":"TOOL_EXEC","adr_version":"v0","decision":"FAIL_HARD_STOP","enforcement_mode":"ENFORCING","kernel_status":"FAIL","profile_status":"PASS","reason_codes":["AAT_K1_PHANTOM_ACTION"],"version_bindings":{"aat_suite_digest":"sha256:0000000000000000000000000000000000000000000000000000000000000000","criteria_digest":"sha256:0000000000000000000000000000000000000000000000000000000000000000","policy_digest":"sha256:0000000000000000000000000000000000000000000000000000000000000000","validator_digest":"sha256:0000000000000000000000000000000000000000000000000000000000000000"}}
